utt_id,text,h,s,b,dimmer,tag
1,조용히 낮 도서관에서 쌀쌀한 기운이 번지는 느낌이다,26,87,88,62,warm
2,문득 주말 거실에서 바람부는 기운이 스며드는 느낌이다,224,48,43,26,sad
3,조용히 아침 거실에서 안개낀 기운이 감싸는 느낌이다,64,100,100,97,energetic
4,살며시 아침 거실에서 안개낀 기운이 감싸는 느낌이다,192,32,18,23,sleepy
5,오후 복도에 안개낀 분위기가 anxious하게 다가온다,197,74,63,45,anxious
6,새벽 도서관에 안개낀 분위기가 grateful하게 다가온다,74,78,95,77,grateful
7,천천히 서재의 포근한 공기가 anxious하게 느껴진다,213,79,54,45,anxious
8,천천히 부엌의 비오는 공기가 grateful하게 느껴진다,79,68,90,81,grateful
9,새벽 방에 쌀쌀한 분위기가 happy하게 다가온다,72,87,92,93,happy
10,조용히 주말 사무실에서 쌀쌀한 기운이 감싸는 느낌이다,53,84,98,89,happy
11,오후 사무실에 비오는 분위기가 grateful하게 다가온다,82,64,87,84,grateful
12,새벽 방에 비오는 분위기가 uncomfortable하게 다가온다,13,44,32,32,uncomfortable
13,문득 평일 방에서 포근한 기운이 번지는 느낌이다,65,100,100,95,energetic
14,가만히 복도의 맑은 공기가 anxious하게 느껴진다,202,71,61,55,anxious
15,천천히 방의 맑은 공기가 sleepy하게 느껴진다,214,44,30,39,sleepy
16,문득 주말 복도에서 비오는 기운이 맴도는 느낌이다,88,97,99,91,energetic
17,어느새 저녁 방에서 쌀쌀한 기운이 맴도는 느낌이다,229,41,19,23,sleepy
18,문득 밤 사무실에서 비오는 기운이 번지는 느낌이다,10,100,88,84,angry
19,살며시 밤 부엌에서 흐린 기운이 흘러가는 느낌이다,225,26,29,37,sleepy
20,살며시 부엌의 쌀쌀한 공기가 energetic하게 느껴진다,70,98,99,97,energetic
21,살며시 사무실의 비오는 공기가 natural하게 느껴진다,67,49,81,75,natural
22,어느새 주말 복도에서 바람부는 기운이 스며드는 느낌이다,88,62,85,93,grateful
23,문득 평일 복도에서 안개낀 기운이 흘러가는 느낌이다,31,51,51,30,tired
24,오후 도서관에 안개낀 분위기가 grateful하게 다가온다,86,68,85,92,grateful
25,문득 부엌의 비오는 공기가 happy하게 느껴진다,40,89,92,88,happy
26,살며시 복도의 포근한 공기가 happy하게 느껴진다,62,100,90,79,happy
27,저녁 사무실에 비오는 분위기가 angry하게 다가온다,0,97,76,72,angry
28,조용히 부엌의 바람부는 공기가 energetic하게 느껴진다,67,99,98,90,energetic
29,조용히 서재의 바람부는 공기가 tired하게 느껴진다,17,50,50,39,tired
30,조용히 아침 부엌에서 맑은 기운이 스며드는 느낌이다,32,44,43,39,tired
31,조용히 아침 거실에서 흐린 기운이 맴도는 느낌이다,78,66,86,92,grateful
32,조용히 사무실의 맑은 공기가 anxious하게 느껴진다,189,63,47,50,anxious
33,새벽 복도에 흐린 분위기가 calm하게 다가온다,46,47,45,55,calm
34,천천히 저녁 서재에서 안개낀 기운이 번지는 느낌이다,89,70,87,91,grateful
35,가만히 주말 방에서 맑은 기운이 감싸는 느낌이다,225,31,18,30,sleepy
36,오후 서재에 안개낀 분위기가 romantic하게 다가온다,279,90,87,70,romantic
37,천천히 오후 거실에서 포근한 기운이 감싸는 느낌이다,205,90,78,70,focused
38,천천히 사무실의 쌀쌀한 공기가 sad하게 느껴진다,219,66,39,35,sad
39,가만히 아침 거실에서 바람부는 기운이 번지는 느낌이다,4,95,80,85,angry
40,살며시 새벽 복도에서 쌀쌀한 기운이 흘러가는 느낌이다,4,96,73,79,angry
41,오후 사무실에 안개낀 분위기가 uncomfortable하게 다가온다,357,44,26,35,uncomfortable
42,어느새 주말 방에서 포근한 기운이 머무는 느낌이다,355,98,75,71,angry
43,가만히 사무실의 바람부는 공기가 energetic하게 느껴진다,69,97,96,91,energetic
44,어느새 평일 베란다에서 안개낀 기운이 번지는 느낌이다,29,49,40,41,tired
45,천천히 아침 거실에서 쌀쌀한 기운이 흘러가는 느낌이다,279,100,84,77,romantic
46,조용히 저녁 도서관에서 흐린 기운이 맴도는 느낌이다,40,43,78,80,natural
47,천천히 밤 서재에서 맑은 기운이 머무는 느낌이다,212,59,28,33,lonely
48,천천히 밤 복도에서 포근한 기운이 머무는 느낌이다,101,76,98,82,grateful
49,조용히 거실의 바람부는 공기가 focused하게 느껴진다,195,86,78,78,focused
50,어느새 부엌의 쌀쌀한 공기가 grateful하게 느껴진다,93,65,93,91,grateful
51,살며시 새벽 사무실에서 쌀쌀한 기운이 머무는 느낌이다,41,58,44,46,calm
52,가만히 베란다의 안개낀 공기가 tired하게 느껴진다,38,55,51,36,tired
53,조용히 아침 부엌에서 안개낀 기운이 번지는 느낌이다,73,74,83,80,grateful
54,저녁 부엌에 맑은 분위기가 lonely하게 다가온다,212,61,39,29,lonely
55,저녁 베란다에 흐린 분위기가 tired하게 다가온다,44,54,37,42,tired
56,어느새 도서관의 비오는 공기가 uncomfortable하게 느껴진다,23,47,37,41,uncomfortable
57,주말 베란다에 비오는 분위기가 calm하게 다가온다,58,69,57,46,calm
58,오후 도서관에 맑은 분위기가 tired하게 다가온다,36,40,40,31,tired
59,천천히 낮 복도에서 맑은 기운이 스며드는 느낌이다,44,93,79,71,warm
60,저녁 부엌에 안개낀 분위기가 lonely하게 다가온다,248,58,41,28,lonely
61,살며시 밤 복도에서 바람부는 기운이 흘러가는 느낌이다,44,88,75,68,warm
62,어느새 저녁 복도에서 바람부는 기운이 번지는 느낌이다,293,98,77,75,romantic
63,천천히 새벽 방에서 흐린 기운이 번지는 느낌이다,194,80,58,59,anxious
64,살며시 낮 방에서 포근한 기운이 스며드는 느낌이다,22,59,50,45,calm
65,문득 아침 방에서 안개낀 기운이 번지는 느낌이다,224,73,44,30,sad
66,저녁 도서관에 맑은 분위기가 tired하게 다가온다,32,50,35,36,tired
67,새벽 사무실에 포근한 분위기가 sleepy하게 다가온다,226,28,27,24,sleepy
68,새벽 도서관에 비오는 분위기가 lonely하게 다가온다,217,58,29,44,lonely
69,조용히 주말 베란다에서 비오는 기운이 번지는 느낌이다,76,65,96,89,grateful
70,조용히 베란다의 흐린 공기가 natural하게 느껴진다,55,35,92,73,natural
71,낮 거실에 흐린 분위기가 focused하게 다가온다,209,78,72,69,focused
72,낮 서재에 흐린 분위기가 grateful하게 다가온다,75,80,97,90,grateful
73,문득 서재의 맑은 공기가 focused하게 느껴진다,207,73,67,61,focused
74,가만히 주말 부엌에서 쌀쌀한 기운이 스며드는 느낌이다,215,42,17,35,sleepy
75,살며시 아침 거실에서 바람부는 기운이 맴도는 느낌이다,210,56,40,37,lonely
76,문득 오후 거실에서 바람부는 기운이 감싸는 느낌이다,193,76,73,65,focused
77,아침 거실에 바람부는 분위기가 tired하게 다가온다,49,57,51,49,tired
78,오후 거실에 포근한 분위기가 angry하게 다가온다,11,100,89,68,angry
79,조용히 베란다의 안개낀 공기가 calm하게 느껴진다,38,45,57,54,calm
80,조용히 밤 사무실에서 맑은 기운이 흘러가는 느낌이다,60,100,100,97,energetic
81,새벽 부엌에 흐린 분위기가 focused하게 다가온다,208,90,80,69,focused
82,문득 낮 부엌에서 포근한 기운이 흘러가는 느낌이다,190,87,67,62,focused
83,가만히 방의 맑은 공기가 calm하게 느껴진다,41,52,44,60,calm
84,가만히 서재의 안개낀 공기가 sleepy하게 느껴진다,203,32,19,25,sleepy
85,조용히 복도의 흐린 공기가 happy하게 느껴진다,51,81,88,95,happy
86,가만히 서재의 맑은 공기가 sad하게 느껴진다,207,51,30,44,sad
87,어느새 도서관의 흐린 공기가 lonely하게 느껴진다,218,66,31,38,lonely
88,조용히 저녁 복도에서 바람부는 기운이 감싸는 느낌이다,10,99,85,71,angry
89,문득 부엌의 비오는 공기가 natural하게 느껴진다,56,35,86,82,natural
90,저녁 베란다에 포근한 분위기가 sad하게 다가온다,208,74,34,39,sad
91,새벽 도서관에 흐린 분위기가 sad하게 다가온다,219,69,30,32,sad
92,밤 방에 흐린 분위기가 grateful하게 다가온다,106,68,85,88,grateful
93,살며시 아침 방에서 바람부는 기운이 맴도는 느낌이다,61,53,85,76,natural
94,문득 복도의 맑은 공기가 sleepy하게 느껴진다,189,45,17,26,sleepy
95,살며시 밤 베란다에서 맑은 기운이 감싸는 느낌이다,46,40,44,51,calm
96,가만히 부엌의 포근한 공기가 sleepy하게 느껴진다,187,34,33,32,sleepy
97,새벽 사무실에 흐린 분위기가 focused하게 다가온다,215,83,80,78,focused
98,오후 사무실에 맑은 분위기가 grateful하게 다가온다,103,65,84,83,grateful
99,평일 부엌에 안개낀 분위기가 happy하게 다가온다,77,93,93,89,happy
100,살며시 밤 도서관에서 안개낀 기운이 스며드는 느낌이다,62,97,99,98,energetic
101,문득 오후 복도에서 비오는 기운이 스며드는 느낌이다,218,76,47,49,anxious
102,살며시 아침 부엌에서 포근한 기운이 맴도는 느낌이다,6,59,35,33,uncomfortable
103,조용히 아침 도서관에서 맑은 기운이 머무는 느낌이다,206,42,23,33,sleepy
104,밤 거실에 안개낀 분위기가 energetic하게 다가온다,64,100,100,98,energetic
105,밤 거실에 쌀쌀한 분위기가 sleepy하게 다가온다,224,43,20,26,sleepy
106,어느새 새벽 방에서 바람부는 기운이 흘러가는 느낌이다,346,100,74,74,angry
107,살며시 부엌의 안개낀 공기가 warm하게 느껴진다,40,93,85,66,warm
108,가만히 밤 서재에서 흐린 기운이 감싸는 느낌이다,34,89,88,61,warm
109,어느새 복도의 쌀쌀한 공기가 focused하게 느껴진다,202,85,80,60,focused
110,조용히 밤 베란다에서 비오는 기운이 흘러가는 느낌이다,213,52,46,35,sad
111,천천히 부엌의 안개낀 공기가 happy하게 느껴진다,52,90,96,83,happy
112,조용히 부엌의 맑은 공기가 lonely하게 느껴진다,213,58,30,44,lonely
113,낮 베란다에 비오는 분위기가 happy하게 다가온다,61,81,95,84,happy
114,낮 사무실에 안개낀 분위기가 energetic하게 다가온다,89,100,100,90,energetic
115,어느새 복도의 비오는 공기가 warm하게 느껴진다,29,91,90,62,warm
116,아침 베란다에 맑은 분위기가 natural하게 다가온다,33,54,79,86,natural
117,문득 주말 사무실에서 흐린 기운이 맴도는 느낌이다,352,41,22,28,uncomfortable
118,저녁 방에 안개낀 분위기가 sad하게 다가온다,213,67,40,52,sad
119,아침 복도에 안개낀 분위기가 focused하게 다가온다,207,73,78,65,focused
120,천천히 거실의 안개낀 공기가 energetic하게 느껴진다,74,98,99,99,energetic
121,어느새 도서관의 안개낀 공기가 calm하게 느껴진다,22,62,48,53,calm
122,밤 도서관에 포근한 분위기가 uncomfortable하게 다가온다,355,48,29,35,uncomfortable
123,오후 거실에 안개낀 분위기가 calm하게 다가온다,20,47,48,45,calm
124,살며시 서재의 맑은 공기가 anxious하게 느껴진다,219,70,49,41,anxious
125,천천히 도서관의 바람부는 공기가 sleepy하게 느껴진다,211,35,27,32,sleepy
126,주말 거실에 맑은 분위기가 tired하게 다가온다,26,45,53,44,tired
127,아침 사무실에 흐린 분위기가 tired하게 다가온다,34,43,42,47,tired
128,살며시 사무실의 바람부는 공기가 calm하게 느껴진다,63,70,52,62,calm
129,살며시 부엌의 바람부는 공기가 lonely하게 느껴진다,229,56,45,26,lonely
130,살며시 베란다의 바람부는 공기가 calm하게 느껴진다,39,42,48,46,calm
131,낮 베란다에 포근한 분위기가 sad하게 다가온다,228,49,39,30,sad
132,어느새 밤 도서관에서 바람부는 기운이 흘러가는 느낌이다,26,80,84,59,warm
133,오후 서재에 안개낀 분위기가 sleepy하게 다가온다,223,38,20,40,sleepy
134,어느새 베란다의 바람부는 공기가 lonely하게 느껴진다,236,56,30,25,lonely
135,살며시 서재의 포근한 공기가 anxious하게 느껴진다,200,69,53,53,anxious
136,어느새 평일 복도에서 안개낀 기운이 머무는 느낌이다,43,49,47,65,calm
137,살며시 사무실의 안개낀 공기가 happy하게 느껴진다,55,84,100,84,happy
138,낮 방에 바람부는 분위기가 grateful하게 다가온다,107,70,88,92,grateful
139,오후 방에 흐린 분위기가 tired하게 다가온다,28,55,49,32,tired
140,조용히 도서관의 안개낀 공기가 energetic하게 느껴진다,69,96,99,93,energetic
141,평일 서재에 맑은 분위기가 calm하게 다가온다,20,68,49,59,calm
142,저녁 사무실에 포근한 분위기가 focused하게 다가온다,209,88,65,76,focused
143,살며시 저녁 사무실에서 바람부는 기운이 머무는 느낌이다,25,55,52,37,tired
144,오후 거실에 맑은 분위기가 tired하게 다가온다,36,40,41,42,tired
145,어느새 도서관의 바람부는 공기가 natural하게 느껴진다,62,44,85,83,natural
146,가만히 사무실의 비오는 공기가 energetic하게 느껴진다,89,98,97,97,energetic
147,가만히 저녁 부엌에서 바람부는 기운이 머무는 느낌이다,62,100,98,90,energetic
148,조용히 부엌의 바람부는 공기가 romantic하게 느껴진다,268,100,91,74,romantic
149,아침 서재에 쌀쌀한 분위기가 focused하게 다가온다,195,83,65,73,focused
150,조용히 평일 거실에서 바람부는 기운이 머무는 느낌이다,219,50,39,25,lonely
151,어느새 저녁 도서관에서 쌀쌀한 기운이 맴도는 느낌이다,29,58,35,48,tired
152,가만히 베란다의 바람부는 공기가 natural하게 느껴진다,34,45,84,73,natural
153,밤 베란다에 흐린 분위기가 focused하게 다가온다,188,82,80,60,focused
154,평일 서재에 안개낀 분위기가 romantic하게 다가온다,275,93,76,66,romantic
155,평일 복도에 포근한 분위기가 angry하게 다가온다,353,100,83,73,angry
156,어느새 밤 부엌에서 비오는 기운이 흘러가는 느낌이다,295,92,84,62,romantic
157,천천히 밤 거실에서 바람부는 기운이 스며드는 느낌이다,0,95,73,75,angry
158,어느새 평일 사무실에서 바람부는 기운이 머무는 느낌이다,81,96,96,96,energetic
159,조용히 저녁 서재에서 흐린 기운이 흘러가는 느낌이다,62,84,90,86,happy
160,살며시 거실의 안개낀 공기가 calm하게 느껴진다,40,51,41,45,calm
161,조용히 저녁 사무실에서 쌀쌀한 기운이 번지는 느낌이다,197,72,46,56,anxious
162,조용히 사무실의 흐린 공기가 calm하게 느껴진다,56,55,49,57,calm
163,가만히 평일 사무실에서 바람부는 기운이 감싸는 느낌이다,93,77,88,86,grateful
164,새벽 베란다에 바람부는 분위기가 romantic하게 다가온다,273,94,81,78,romantic
165,문득 거실의 흐린 공기가 warm하게 느껴진다,20,94,89,73,warm
166,평일 서재에 쌀쌀한 분위기가 warm하게 다가온다,37,88,74,63,warm
167,어느새 낮 도서관에서 바람부는 기운이 감싸는 느낌이다,188,80,47,50,anxious
168,조용히 도서관의 쌀쌀한 공기가 angry하게 느껴진다,356,100,89,74,angry
169,새벽 베란다에 흐린 분위기가 calm하게 다가온다,39,61,47,62,calm
170,천천히 방의 쌀쌀한 공기가 angry하게 느껴진다,357,99,82,83,angry
171,문득 사무실의 안개낀 공기가 anxious하게 느껴진다,191,60,58,52,anxious
172,조용히 도서관의 맑은 공기가 sad하게 느껴진다,234,62,38,32,sad
173,문득 오후 사무실에서 안개낀 기운이 맴도는 느낌이다,230,66,43,47,sad
174,천천히 오후 거실에서 포근한 기운이 번지는 느낌이다,212,62,64,46,anxious
175,오후 도서관에 바람부는 분위기가 calm하게 다가온다,33,53,50,55,calm
176,오후 거실에 포근한 분위기가 anxious하게 다가온다,213,71,54,54,anxious
177,어느새 베란다의 바람부는 공기가 calm하게 느껴진다,24,47,54,61,calm
178,어느새 낮 서재에서 포근한 기운이 머무는 느낌이다,198,71,66,75,focused
179,주말 베란다에 쌀쌀한 분위기가 uncomfortable하게 다가온다,355,42,21,36,uncomfortable
180,어느새 베란다의 비오는 공기가 focused하게 느껴진다,196,77,78,76,focused
181,천천히 새벽 복도에서 바람부는 기운이 머무는 느낌이다,195,32,32,35,sleepy
182,문득 도서관의 흐린 공기가 energetic하게 느껴진다,73,97,95,92,energetic
183,가만히 새벽 서재에서 비오는 기운이 흘러가는 느낌이다,37,68,54,58,calm
184,가만히 베란다의 바람부는 공기가 anxious하게 느껴진다,218,63,58,41,anxious
185,문득 서재의 바람부는 공기가 uncomfortable하게 느껴진다,7,48,21,30,uncomfortable
186,가만히 사무실의 흐린 공기가 sleepy하게 느껴진다,214,25,17,34,sleepy
187,가만히 오후 서재에서 포근한 기운이 감싸는 느낌이다,356,95,85,84,angry
188,밤 베란다에 비오는 분위기가 natural하게 다가온다,36,47,86,73,natural
189,평일 복도에 포근한 분위기가 sleepy하게 다가온다,210,35,26,28,sleepy
190,평일 베란다에 포근한 분위기가 anxious하게 다가온다,204,73,46,55,anxious
191,가만히 저녁 베란다에서 흐린 기운이 스며드는 느낌이다,43,45,83,84,natural
192,어느새 서재의 흐린 공기가 energetic하게 느껴진다,57,99,98,95,energetic
193,천천히 사무실의 포근한 공기가 grateful하게 느껴진다,107,71,84,77,grateful
194,밤 베란다에 흐린 분위기가 warm하게 다가온다,30,81,85,57,warm
195,살며시 도서관의 비오는 공기가 angry하게 느껴진다,359,99,76,70,angry
196,조용히 부엌의 쌀쌀한 공기가 uncomfortable하게 느껴진다,3,57,33,26,uncomfortable
197,평일 도서관에 맑은 분위기가 romantic하게 다가온다,285,91,81,69,romantic
198,살며시 주말 방에서 흐린 기운이 맴도는 느낌이다,16,59,36,42,uncomfortable
199,가만히 주말 방에서 흐린 기운이 번지는 느낌이다,187,69,47,55,anxious
200,낮 서재에 포근한 분위기가 energetic하게 다가온다,52,97,95,91,energetic
201,가만히 오후 방에서 바람부는 기운이 스며드는 느낌이다,41,53,87,72,natural
202,가만히 밤 부엌에서 쌀쌀한 기운이 맴도는 느낌이다,29,54,28,41,uncomfortable
203,평일 서재에 바람부는 분위기가 lonely하게 다가온다,239,61,39,37,lonely
204,가만히 부엌의 쌀쌀한 공기가 warm하게 느껴진다,33,84,80,72,warm
205,저녁 도서관에 포근한 분위기가 grateful하게 다가온다,95,70,84,91,grateful
206,아침 베란다에 바람부는 분위기가 natural하게 다가온다,66,41,83,73,natural
207,어느새 아침 도서관에서 안개낀 기운이 스며드는 느낌이다,43,41,56,65,calm
208,어느새 서재의 흐린 공기가 natural하게 느껴진다,31,47,78,82,natural
209,살며시 거실의 흐린 공기가 energetic하게 느껴진다,83,100,95,99,energetic
210,문득 주말 도서관에서 안개낀 기운이 흘러가는 느낌이다,54,96,100,95,happy
211,오후 사무실에 흐린 분위기가 angry하게 다가온다,355,95,90,68,angry
212,가만히 도서관의 비오는 공기가 tired하게 느껴진다,47,51,39,35,tired
213,새벽 복도에 흐린 분위기가 energetic하게 다가온다,63,96,100,98,energetic
214,조용히 사무실의 바람부는 공기가 tired하게 느껴진다,10,47,55,48,tired
215,조용히 아침 베란다에서 비오는 기운이 맴도는 느낌이다,226,40,22,21,sleepy
216,가만히 거실의 쌀쌀한 공기가 lonely하게 느껴진다,244,58,32,32,lonely
217,문득 저녁 사무실에서 포근한 기운이 번지는 느낌이다,97,64,96,89,grateful
218,가만히 거실의 포근한 공기가 happy하게 느껴진다,56,96,94,94,happy
219,주말 복도에 비오는 분위기가 warm하게 다가온다,39,83,74,56,warm
220,천천히 부엌의 쌀쌀한 공기가 anxious하게 느껴진다,208,80,60,45,anxious
221,가만히 저녁 복도에서 쌀쌀한 기운이 번지는 느낌이다,238,50,45,33,lonely
222,오후 부엌에 비오는 분위기가 sad하게 다가온다,203,56,36,54,sad
223,어느새 저녁 도서관에서 바람부는 기운이 번지는 느낌이다,47,81,89,93,happy
224,문득 아침 부엌에서 안개낀 기운이 감싸는 느낌이다,359,53,32,37,uncomfortable
225,주말 서재에 흐린 분위기가 grateful하게 다가온다,84,69,87,88,grateful
226,천천히 오후 복도에서 바람부는 기운이 흘러가는 느낌이다,17,44,37,36,tired
227,밤 부엌에 흐린 분위기가 grateful하게 다가온다,106,77,88,88,grateful
228,평일 방에 비오는 분위기가 lonely하게 다가온다,235,53,32,28,lonely
229,저녁 도서관에 맑은 분위기가 natural하게 다가온다,69,42,80,84,natural
230,아침 부엌에 맑은 분위기가 anxious하게 다가온다,209,75,65,53,anxious
231,가만히 오후 방에서 쌀쌀한 기운이 감싸는 느낌이다,26,50,45,34,tired
232,가만히 거실의 쌀쌀한 공기가 tired하게 느껴진다,15,52,46,44,tired
233,오후 거실에 안개낀 분위기가 energetic하게 다가온다,80,100,100,95,energetic
234,주말 부엌에 비오는 분위기가 lonely하게 다가온다,220,69,34,36,lonely
235,조용히 낮 도서관에서 흐린 기운이 맴도는 느낌이다,48,80,88,85,happy
236,오후 도서관에 포근한 분위기가 warm하게 다가온다,28,86,87,66,warm
237,어느새 오후 거실에서 맑은 기운이 스며드는 느낌이다,220,60,33,29,lonely
238,낮 서재에 포근한 분위기가 sad하게 다가온다,227,60,41,51,sad
239,살며시 평일 서재에서 바람부는 기운이 맴도는 느낌이다,273,99,87,78,romantic
240,살며시 복도의 비오는 공기가 happy하게 느껴진다,78,83,92,76,happy
241,문득 밤 거실에서 흐린 기운이 감싸는 느낌이다,30,48,52,45,tired
242,오후 사무실에 포근한 분위기가 warm하게 다가온다,17,86,87,73,warm
243,어느새 도서관의 포근한 공기가 grateful하게 느껴진다,70,69,93,86,grateful
244,평일 사무실에 바람부는 분위기가 tired하게 다가온다,48,50,44,31,tired
245,어느새 사무실의 포근한 공기가 angry하게 느껴진다,356,97,90,68,angry
246,문득 서재의 포근한 공기가 uncomfortable하게 느껴진다,353,55,32,29,uncomfortable
247,조용히 서재의 비오는 공기가 angry하게 느껴진다,15,100,76,69,angry
248,조용히 주말 방에서 맑은 기운이 번지는 느낌이다,230,53,30,26,lonely
249,오후 사무실에 안개낀 분위기가 focused하게 다가온다,209,84,78,75,focused
250,주말 서재에 쌀쌀한 분위기가 anxious하게 다가온다,189,64,46,55,anxious
251,평일 사무실에 포근한 분위기가 focused하게 다가온다,210,85,69,76,focused
252,조용히 주말 서재에서 쌀쌀한 기운이 흘러가는 느낌이다,38,38,80,85,natural
253,저녁 서재에 안개낀 분위기가 tired하게 다가온다,38,55,43,41,tired
254,저녁 베란다에 흐린 분위기가 energetic하게 다가온다,74,97,96,90,energetic
255,어느새 밤 복도에서 흐린 기운이 머무는 느낌이다,82,98,99,99,energetic
256,문득 새벽 서재에서 비오는 기운이 스며드는 느낌이다,273,100,84,67,romantic
257,밤 복도에 맑은 분위기가 anxious하게 다가온다,198,78,53,55,anxious
258,낮 복도에 바람부는 분위기가 natural하게 다가온다,62,35,81,77,natural
259,살며시 주말 서재에서 흐린 기운이 맴도는 느낌이다,208,73,51,45,anxious
260,오후 부엌에 흐린 분위기가 angry하게 다가온다,358,98,78,83,angry
261,평일 방에 포근한 분위기가 focused하게 다가온다,195,87,69,69,focused
262,가만히 아침 방에서 비오는 기운이 맴도는 느낌이다,276,100,77,61,romantic
263,문득 부엌의 비오는 공기가 tired하게 느껴진다,32,44,53,47,tired
264,새벽 거실에 흐린 분위기가 grateful하게 다가온다,83,77,84,83,grateful
265,아침 베란다에 비오는 분위기가 romantic하게 다가온다,269,98,90,76,romantic
266,어느새 평일 복도에서 안개낀 기운이 흘러가는 느낌이다,89,62,83,91,grateful
267,평일 베란다에 포근한 분위기가 lonely하게 다가온다,239,55,33,40,lonely
268,조용히 서재의 맑은 공기가 tired하게 느껴진다,14,40,41,45,tired
269,밤 방에 비오는 분위기가 romantic하게 다가온다,270,97,91,61,romantic
270,조용히 낮 사무실에서 바람부는 기운이 스며드는 느낌이다,47,98,88,76,happy
271,가만히 아침 베란다에서 흐린 기운이 번지는 느낌이다,64,61,58,52,calm
272,낮 서재에 흐린 분위기가 anxious하게 다가온다,206,76,53,47,anxious
273,아침 서재에 비오는 분위기가 lonely하게 다가온다,237,51,45,37,lonely
274,살며시 낮 복도에서 맑은 기운이 맴도는 느낌이다,38,64,55,65,calm
275,가만히 서재의 안개낀 공기가 natural하게 느껴진다,38,49,79,75,natural
276,어느새 도서관의 안개낀 공기가 anxious하게 느껴진다,205,63,64,41,anxious
277,평일 도서관에 안개낀 분위기가 romantic하게 다가온다,269,90,81,73,romantic
278,오후 사무실에 바람부는 분위기가 angry하게 다가온다,359,100,77,73,angry
279,저녁 베란다에 맑은 분위기가 romantic하게 다가온다,284,92,89,78,romantic
280,조용히 저녁 베란다에서 흐린 기운이 맴도는 느낌이다,73,95,98,85,happy
